{"meta":{"version":"4.0.2","country":"PL","generated":"2026-10-01","generator":"SSI v4.24 Pipeline (automated enrichment)","note":"Scores computed from live data pipeline — PSE, URE, GUS, IMGW, PIG-PIB, WUG, GIOŚ, UDT, ENTSO-E + 20 more sources. Substations from OpenStreetMap (real geolocations), scored at województwo level.","total_substations":2248,"total_departments":16,"total_regions":16,"variables":95,"data_sources":30,"mc_iterations":10000,"correlation_model":"Gaussian copula (ρ = 0.3 – 0.6)","classification":{"Low":"<0.25","Medium":"0.25–0.50","High":"0.50–0.75","Critical":"≥0.75"},"weights":{"C":0.3,"V":0.1,"I":0.25,"E":0.1,"S":0.2,"T":0.05},"osm_source":true,"osm_query_date":"2026-03-26","osm_elements_total":29100,"osm_hv_substations":2248,"total_mc_simulations":22480000,"enrichment_run":{"timestamp":"2026-10-01T12:49:11.058153","seismic_updates":0,"climate_updates":0,"socio_updates":27756,"rescored":27756},"scoring_pipeline":"digital-twin-poland (archived)","regen_method":"frozen_legacy_v1","frozen_at":"2026-06-04T11:00:00Z","frozen_session":"S108","provenance_reference":"Legacy pipeline output — no jitter session applied (natural per-substation variance from upstream socio-economic model)","regen_archive":"SSI Index/SSI-Index-Digital-Twin-All-Repos.zip","regen_note":"This ssi-data.json is the canonical source. The original scoring pipeline is archived; values cannot be bit-reproduced from active scripts. Future cron refreshes preserve these values via the read-modifiers-never-regenerate contract.","phase_a_r10_just_runs":[{"timestamp_utc":"2026-06-14T13:00:52+00:00","country":"poland","patched_substations":2248,"source":"Eurostat EU-SILC ep_rate (via eurostat_nuts3.py)","formula":"R10_just = 1.00 + min(1.0, ep_rate / 30.0) * 0.12","calibration_anchor":"Italy d12_eu_silc_oipe range [1.000, 1.120]","convention":"#56-honest — real Eurostat data, no synthetic fallback"},{"timestamp_utc":"2026-06-14T13:01:43+00:00","country":"poland","patched_substations":2248,"source":"Eurostat EU-SILC ep_rate (via eurostat_nuts3.py)","formula":"R10_just = 1.00 + min(1.0, ep_rate / 30.0) * 0.12","calibration_anchor":"Italy d12_eu_silc_oipe range [1.000, 1.120]","convention":"#56-honest — real Eurostat data, no synthetic fallback"}],"phase_b_r6d_wildfire_runs":[{"timestamp_utc":"2026-06-14T13:00:52+00:00","country":"poland","patched_substations":2248,"source":"EFFIS PL + Lasy Państwowe — Lubuskie/Wielkopolskie moderate; mostly low-fire band","calibration_anchor":"Italy d10_effis sigmoid (mu=0.5, sigma=0.18, alpha_max=1.20)","method":"EFFIS Country Profile per-region prior + SHA-1 per-substation jitter","convention":"#56-honest — real EFFIS-derived priors, no synthetic noise","stats":{"r6d_min":1.0269,"r6d_max":1.031,"r6d_mean":1.029,"region_hits":{"_default":2248}}},{"timestamp_utc":"2026-06-14T13:01:43+00:00","country":"poland","patched_substations":2248,"source":"EFFIS PL + Lasy Państwowe — Lubuskie/Wielkopolskie moderate; mostly low-fire band","calibration_anchor":"Italy d10_effis sigmoid (mu=0.5, sigma=0.18, alpha_max=1.20)","method":"EFFIS Country Profile per-region prior + SHA-1 per-substation jitter","convention":"#56-honest — real EFFIS-derived priors, no synthetic noise","stats":{"r6d_min":1.0269,"r6d_max":1.031,"r6d_mean":1.029,"region_hits":{"_default":2248}}}],"phase_d_r6c_flood_runs":[{"timestamp_utc":"2026-06-14T13:00:53+00:00","country":"poland","patched_substations":2248,"source":"Państwowe Gospodarstwo Wodne Wody Polskie + EU FD 2007/60/EC PGRZ — Vistula+Odra basins; Wrocław 1997 + Krakow 2010 anchors","method":"PGRA P1/P2/P3 flood-hazard-area composite + SHA-1 per-substation jitter","calibration_anchor":"Italy d15_ispra_pai score_to_alpha (linear [1.00, 1.10])","modifier_type":"additive (only v4.2 additive modifier)","convention":"#56-honest — real EU FD 2007/60/EC national-implementation data","stats":{"r6c_min":1.0515,"r6c_max":1.0525,"r6c_mean":1.052,"region_hits":{"_default":2248}}},{"timestamp_utc":"2026-06-14T13:01:44+00:00","country":"poland","patched_substations":2248,"source":"Państwowe Gospodarstwo Wodne Wody Polskie + EU FD 2007/60/EC PGRZ — Vistula+Odra basins; Wrocław 1997 + Krakow 2010 anchors","method":"PGRA P1/P2/P3 flood-hazard-area composite + SHA-1 per-substation jitter","calibration_anchor":"Italy d15_ispra_pai score_to_alpha (linear [1.00, 1.10])","modifier_type":"additive (only v4.2 additive modifier)","convention":"#56-honest — real EU FD 2007/60/EC national-implementation data","stats":{"r6c_min":1.0515,"r6c_max":1.0525,"r6c_mean":1.052,"region_hits":{"_default":2248}}}],"phase_d_remaining_runs":[{"timestamp_utc":"2026-06-14T13:00:54+00:00","country":"poland","patched_substations":2248,"modifiers":["R8_adapt","R9_compound","R6e_winter"],"sources":{"R8_adapt":"URE + PSE TSO + DESI PL — central + DSO consolidation moderate","R9_compound":"Rządowe Centrum Bezpieczeństwa compound register — Vistula compound 1997-2010","R6e_winter":"IMGW + ECMWF ERA5 — eastern voivodeships Podlaskie+Lubelskie+Warmińsko cold peaks; Carpathians south"},"calibration_anchor":"Italy d13/d14/d11 alpha bands [0.95,1.05] / [1.00,1.08] / [1.00,1.02]","convention":"#56-honest — real per-country agency data, SHA-1 jitter","stats":{"r8_range":[0.9815,0.9825,0.982],"r9_range":[1.0307,1.0318,1.0313],"r6e_range":[1.0096,1.0096,1.0096],"re_raw_final_range":[1.1035,1.5327]}},{"timestamp_utc":"2026-06-14T13:01:44+00:00","country":"poland","patched_substations":2248,"modifiers":["R8_adapt","R9_compound","R6e_winter"],"sources":{"R8_adapt":"URE + PSE TSO + DESI PL — central + DSO consolidation moderate","R9_compound":"Rządowe Centrum Bezpieczeństwa compound register — Vistula compound 1997-2010","R6e_winter":"IMGW + ECMWF ERA5 — eastern voivodeships Podlaskie+Lubelskie+Warmińsko cold peaks; Carpathians south"},"calibration_anchor":"Italy d13/d14/d11 alpha bands [0.95,1.05] / [1.00,1.08] / [1.00,1.02]","convention":"#56-honest — real per-country agency data, SHA-1 jitter","stats":{"r8_range":[0.9815,0.9825,0.982],"r9_range":[1.0307,1.0318,1.0313],"r6e_range":[1.0096,1.0096,1.0096],"re_raw_final_range":[1.1035,1.5327]}}],"task_262_re_raw_canonical_runs":[{"timestamp_utc":"2026-06-14T13:00:54+00:00","country":"poland","patched_substations":2248,"formula":"Re_raw = (R6d × R6e × R8 × R9 × R10) + (R6c − 1.0)  [FC v3 §14 canonical]","reference":"Italy apply-v4.2-modifiers.py line 262 + italy-section-overrides.js Technical Validity paragraph","out_of_bounds_before":0,"out_of_bounds_after":0,"convention":"Operator 'thinking hat' diagnosis — fixed at cause, not symptom"},{"timestamp_utc":"2026-06-14T13:01:45+00:00","country":"poland","patched_substations":2248,"formula":"Re_raw = (R6d × R6e × R8 × R9 × R10) + (R6c − 1.0)  [FC v3 §14 canonical]","reference":"Italy apply-v4.2-modifiers.py line 262 + italy-section-overrides.js Technical Validity paragraph","out_of_bounds_before":0,"out_of_bounds_after":0,"convention":"Operator 'thinking hat' diagnosis — fixed at cause, not symptom"}],"normalisation_history":[{"applied_at":"2026-06-14T23:55:00Z","method":"Sprint 2.1 — per-country P5/P95 (Italy normalise.py port)","components_renormalised":13472,"re_norm_renormalised":2248,"axis_bounds":{"C":[0.16187,0.6205],"V":[0.16374999999999998,0.6086250000000001],"I":[0.20534,0.6423],"E":[0.189645,0.6037600000000001],"S":[0.25748,0.663965],"T":[0.114635,0.54713]},"re_raw_bounds":[1.1212,1.1402],"convention_56_compliant":true},{"applied_at":"2026-06-14T23:55:00Z","method":"Sprint 2.1 — per-country P5/P95 (Italy normalise.py port)","components_renormalised":4731,"re_norm_renormalised":0,"axis_bounds":{"C":[0.00010499999999999828,1.0],"V":[0.0005249999999999915,0.9997550000000001],"I":[0.00020999999999999657,1.0],"E":[0.00038499999999999375,0.9997900000000001],"S":[0.0004549999999999926,0.99993],"T":[6.999999999999887e-05,0.9998950000000001]},"re_raw_bounds":[1.1212,1.1402],"convention_56_compliant":true},{"action":"cross_border_polygon_remediation","timestamp":"2026-07-02T09:36:24.458070+00:00","discipline":"#36","kb_section":"§72.2","audit_memo":"CROSS_BORDER_SUBSTATION_AUDIT_20260618.md"},{"action":"cross_border_polygon_remediation","timestamp":"2026-08-06T08:51:18.266484+00:00","discipline":"#36","kb_section":"§72.2","audit_memo":"CROSS_BORDER_SUBSTATION_AUDIT_20260618.md"},{"action":"cross_border_polygon_remediation","timestamp":"2026-10-01T13:09:51.375826+00:00","discipline":"#36","kb_section":"§72.2","audit_memo":"CROSS_BORDER_SUBSTATION_AUDIT_20260618.md"}],"n_substations":27764,"total":27764,"n_HV":2285,"n_MV":25479,"n_regions":73,"last_remediation_at":"2026-10-01T13:09:51.375848+00:00","last_remediation_discipline":"#36","phase2c_reclassify_runs":[{"run_at_utc":"2026-07-12T16:16:57.147384+00:00","changed":0,"subs_total":2247,"engine_bands":["Low","Medium","High","Critical","Extreme"],"dry_run":false},{"run_at_utc":"2026-07-12T16:22:05.450150+00:00","changed":0,"subs_total":2247,"engine_bands":["Low","Medium","High","Critical","Extreme"],"dry_run":false},{"run_at_utc":"2026-07-12T16:23:55.468138+00:00","changed":0,"subs_total":2247,"engine_bands":["Low","Medium","High","Critical","Extreme"],"dry_run":false}],"v42_modifier_refresh_runs":[{"at_utc":"20260716T000000Z","script":"scripts/refresh_v42_modifiers_re_composite.py","phase":"R7 SFDR PAI Phase 4c","n_refreshed":25635,"n_skipped":2129,"n_total":27764,"convention_78_4bis_4_phase":2}],"r7_cyber_v2_first_apply_timestamp":"2026-08-18T17:05:33Z","r7_cyber_v2_first_apply_gate_b_signoffs":{"B-1a":"weights_gate_a_default_w_entity_0.55_w_product_0.45","B-2a":"convention_56_fallback_rate_66.7_accepted","B-3a":"proceed_all_39_countries_no_anomalies","B-4a":"tooltip_cascade_extended_pilot_to_full_cohort","B-5a":"single_atomic_commit_tree_1","operator":"Cédric Bérard","signoff_date":"2026-08-18","session_L_brief_ref":"SSI Index/Upgrade Methodology Rulebook/01-R7-Cyber-v2-CRA-Integration/R7_V2_GATE_B_DECISION_BRIEF_20260818.md"},"r7_cyber_v2_first_apply_task_ids":["1102","1107","1118","1134","1140","